<?xml version="1.0" encoding="UTF-8"?>
<device_types xmlns:xsi="http://www.w3.org/2001/XMLSchema-instance"
 xsi:noNamespaceSchemaLocation="device_types.xsd">
	<device_type device_type_id="1">
		<device_type_name>smartphone</device_type_name>
		<device_brand device_brand_id="1">
			<brand_name>Apple</brand_name>
		</device_brand>
	</device_type>
	<device_type device_type_id="2">
		<device_type_name>smartphone</device_type_name>
		<device_brand device_brand_id="2">
			<brand_name>Samsung</brand_name>
		</device_brand>
	</device_type>
	<device_type device_type_id="3">
		<device_type_name>smartphone</device_type_name>
		<device_brand device_brand_id="4">
			<brand_name>Google</brand_name>
		</device_brand>
	</device_type>
	<device_type device_type_id="4">
		<device_type_name>tablet</device_type_name>
		<device_brand device_brand_id="1">
			<brand_name>Apple</brand_name>
		</device_brand>
	</device_type>
	<device_type device_type_id="5">
		<device_type_name>tablet</device_type_name>
		<device_brand device_brand_id="2">
			<brand_name>Samsung</brand_name>
		</device_brand>
	</device_type>
</device_types>